{
  "gallery_id": "openclaw-seed-gallery-v1",
  "description": "First structured benchmark set reconstructed from the documented OpenClaw deck lessons and validated slide pattern notes.",
  "deck_id": "openclaw-executive",
  "extraction_mode": "documented_seed",
  "references": [
    "openclaw-executive--seed-01--cover-orbit.json",
    "openclaw-executive--seed-02--bottleneck-shift.json",
    "openclaw-executive--seed-03--chapter-summary-signal.json",
    "openclaw-executive--seed-04--narrative-map.json",
    "openclaw-executive--seed-05--trust-terminal.json",
    "openclaw-executive--seed-06--layered-architecture-stack.json"
  ],
  "pattern_cards": [
    "openclaw-executive--seed--cover_orbit.pattern.json",
    "openclaw-executive--seed--bottleneck_shift.pattern.json",
    "openclaw-executive--seed--chapter_summary_signal.pattern.json",
    "openclaw-executive--seed--narrative_map.pattern.json",
    "openclaw-executive--seed--trust_terminal.pattern.json",
    "openclaw-executive--seed--layered_architecture_stack.pattern.json"
  ]
}
